Policy,Year,Country,Policy_Content,URL,Scope,Allocation,Sectoral coverage,GHGs covered,Offsets credits,Cap,Source
China - Shanghai pilot ETS,2013,China,"Shanghai was the second Chinese region to start its pilot ETS, in November 2013. The pilot covers more than half* of the city’s emissions, including industry and non-industrial sectors such as buildings, aviation, and shipping. The system covered electricity generation until 2020, after which it was integrated into the national ETS. It is the only pilot that has achieved a 100% compliance rate continuously since its launch.  In 2016, Shanghai expanded its ETS coverage by adding shipping and more industrial sectors, as well as by lowering the participation threshold of existing power plants and participant industries to 10,000 tCO2 per year.   Shanghai is the most active among the Chinese pilots in terms of offset credits trading. It also pioneered allowance spot forward trading in China. In January 2017, the Shanghai Environmental and Energy Exchange (SEEE) and the Shanghai Clearing House jointly launched an over-the-counter Shanghai Emission Allowance Forward contract, with central counterparty clearing, as an innovative financial product that serves a purpose similar to carbon financial derivatives.** By the end of September 2021, the Shanghai carbon market had traded a total of 173 million tonnes of spot products, with a cumulative transaction volume of about CNY 2 billion (USD 310 million), while also handling the highest trading volume of offsets credits. Shanghai has carried out various other carbon finance innovations such as repurchases, carbon funds, carbon trusts, CCER pledge loans, green bonds, and carbon margin trading.   In early 2019, the ETS-related responsibilities in Shanghai completed the transition from the Development and Reform Commission (DRC) to the Ecology and Environment Bureau (EEB), as a result of the governance restructuring across China.  In December 2017, Shanghai was selected to lead the development of the trading platform for the national ETS. Since July 2021, the trading platform operated by the SEEE has been the dedicated avenue for allowances trading in the national ETS.      * The coverage rate would reduce significantly in 2020 given the transfer of power generation entities into national ETS but there is no publicly available data.  ** China is still in the exploratory and research stage of carbon futures trading and, according to the “Administrative Regulations on Futures Trading” document, futures contracts can only be traded on approved professional futures exchanges. Therefore, regional ETS pilots cannot introduce futures trading. However, a few have developed carbon forward trading products with their own characteristics.",https://icapcarbonaction.com/en/ets_system/62,SubNational,Free Allocation (Grandparenting; Benchmarking) and Auctioning,"Transport,Buildings,Industry",CO2 only,Provincial,105 MtCO2 (2020),ICAP
China - Shenzhen pilot ETS,2013,China,"The Shenzhen Pilot ETS began in June 2013 and was the first of the Chinese pilots to start operation. As a city of Guangdong province (that has its own separate ETS pilot), Shenzhen is the only Chinese pilot at the sub-province level, and it covers a broad scope across the energy, industry, building, and transport sectors.* The Shenzhen Pilot ETS covers a total of 687 entities. Mainly based on free allocation, Shenzhen’s allocation plans have not been made publicly available since 2016. A unique feature of this pilot ETS is its legal basis: although the majority of pilots are regulated by subnational government orders by the executive body of the government, the Shenzhen Pilot ETS is regulated by a dedicated ETS bill passed by its municipal legislator, the Shenzhen People’s Congress. This provides more legal stability.   Shenzhen is one of the most active regional markets in China, despite its relatively small size compared to other pilots. By the end of 2021, Shenzhen’s cumulative trading volume and turnover amounted to 65.17 million tonnes and CNY 1.46 billion (USD 230 million) respectively, one of the few pilots to surpass CNY 1 billion (USD 167 million). The Shenzhen ETS pilot is open to diversified market participants, including covered entities and institutional as well as individual (domestic and foreign) investors. Shenzhen has carried out various carbon finance innovations such as repurchases and allowance pledge loans.   Shenzhen also has pioneered cross-regional cooperation. In 2014, Shenzhen and Baotou signed the “Memorandum of Strategic Cooperation on the Construction of Carbon Trading Systems”. As a consequence of this, six companies in Baotou City of the Inner Mongolia Autonomous Region were covered by the Shenzhen Pilot ETS on a voluntary basis for one compliance year starting in June 2016.  In early 2019, the ETS-related responsibilities in Shenzhen completed the transition from the Development and Reform Commission of Shenzhen Municipality to the Ecology Environment Bureau of Shenzhen Municipality (EEB),** as a result of the governance restructuring across China.      * Power was covered until 2019, after which it transitioned to the national ETS.   ** MEEB’s predecessor was the Human Settlements and Environment Commission of Shenzhen Municipality.",https://icapcarbonaction.com/en/ets_system/63,SubNational,Free allocation (Grandparenting; Benchmarking),"Transport,Buildings,Industry",CO2 only,National and provincial (in development),"31. 5 MtCO2 (excluding buildings, 2015)",ICAP
China - Tianjin pilot ETS,2013,China,"Tianjin launched its pilot ETS in December 2013 and has concluded eight compliance years so far. The system covers: heat and electricity production (until 2020; from 2021 power is covered by the national ETS); iron and steel; petrochemicals; chemicals; oil and gas exploration; papermaking; aviation; and building materials. Covered entities accounted for 50-60%* of the city’s total emissions in 2020.    The Tianjin Ecology and Environment Bureau (EEB) is responsible for the governance of the Tianjin Pilot ETS since 2019, taking over from the Development and Reform Commission. Since then, Tianjin has further enhanced the legal foundation of its ETS and continuously improved its market performance.   In 2020, the Tianjin municipal government released the latest version of the “Tianjin Interim Measures for the Administration of Carbon Emissions Trading”, which is a regulatory document released every few years providing the legal basis for the regional carbon market. The latest iteration extends the Tianjin Pilot ETS until the end of June 2025 and introduces the following main changes:   adding air pollution control as one of the purposes;  	explicitly excluding covered entities under the operational national ETS from the Tianjin Pilot ETS; and  	strengthening enforcement measures: companies failing to surrender enough allowances to match their emissions will face double the amount of the shortfall deducted from the next year’s allocation, and third-party verifiers found to not comply with regulations will be banned for three years.  Tianjin also introduced auctioning gradually and has seen more active trading recently. In 2019, a successful auction was held for the first time. In 2020 and 2021, Tianjin ETS held two auctions in each compliance year.   Tianjin’s market size for China Certified Emission Reductions (CCERs) and allowances has also increased significantly in the past years. For 2021, the Tianjin ETS was the third-largest regional pilot in terms of traded CCER volume and second largest when allowances are also considered.     * There is no official data, so emissions coverage given here is an estimate.",https://icapcarbonaction.com/en/ets_system/65,SubNational,Free Allocation (Grandparenting; Benchmarking) and Auctioning,"DomesticAviation,Industry,Power",CO2 only,Provincial,120 MtCO2 (2020),ICAP
Colombia,,Colombia,"In 2018, Colombia adopted a law for climate change management, which outlines provisions for the establishment of a “National Program of Greenhouse Gas Tradable Emission Quotas” (Programa Nacional de Cupos Transables de Emisión de Gases de Efecto Invernadero – PNCTE).   The law outlines the basic provisions for the PNCTE. The Ministry of Environment and Sustainable Development (Minambiente) will determine the number of allowances, in line with Colombia’s national mitigation targets. Minambiente is also in charge of allocation, which will take place primarily via auctions. Non-compliance is to be punishable by a fine of up to two times the auction price. Auction revenues will be directed to the National Environmental Fund and will be used for GHG reductions and mitigation projects, as well as to manage implementation of the law. The bill also includes crediting provisions: voluntary actions of non-regulated entities that generate GHG emissions reductions or removals could be issued allowances if they are verified, certified, registered in the National Emission Reductions Registry (Registro nacional de reducción de emisiones de GEI – Renare), and deemed eligible for the program.  The PNCTE will complement other mitigation instruments, such as the country’s existing USD 5/tonne carbon tax and its offsetting program, both of which have been in place since 2017. The 2018 Climate Change Law states that the government may recognize carbon tax payments as part of the compliance obligation of regulated entities under the PNCTE.   The ETS design is currently being analyzed by the government. The “Climate Action Law” (Ley de Acción Climática), which came into force in December 2021, consolidates the commitments presented in Colombia’s NDC and sets a goal to fully implement the ETS by 2030. This law has also set an obligation for legal persons to report direct and indirect GHG emissions, following criteria to be set by Minambiente. It also appoints an independent group of experts (the Study Commission) to generate recommendations and promote and develop carbon markets in Colombia. These recommendations are to be considered by the environment and finance ministries.",https://icapcarbonaction.com/en/ets_system/92,National,,,,,,ICAP
EU Emissions Trading System (EU ETS),2005,Austria,"The European Union Emissions Trading System (EU ETS) is a cornerstone instrument of the EU’s policy framework to combat climate change and reduce GHG emissions at least cost. The system covered ~36% of the total emissions of the European Economic Area (EEA) in 2020-21, encompassing activities from the power sector, manufacturing industry, and aviation (including flights from the EEA to the United Kingdom).   Introduced in 2005 and now in its fourth trading phase, the EU ETS is the oldest system in force. Since 2005, stationary installations have cut emissions by around 43%.    Since its launch, the EU ETS has gone through several reforms. The latest revision of the system’s framework was completed in 2018 and took effect in January 2021, for phase 4. The European Commission proposed further reforms to the ETS in 2021 to deliver on the “European Green Deal”.   The EU ETS and the Swiss ETS are linked as of 2020. Any policy updates in either jurisdiction will have to be considered accordingly under the linking arrangement.",https://icapcarbonaction.com/en/ets_system/43,National,Auctioning; Free Allocation (Benchmarking),"DomesticAviation,Industry,Power","CO2, N2O, PFCs",Offsets and international credits can no longer be used from phase 4 (2021-2030),"1,597 MtCO2e (2021)",ICAP
EU Emissions Trading System for buildings and road transport,,Austria,"The European Commission proposed the new ETS for buildings and road transport to address growing emissions from these sectors in a cost-effective way. The system would complement Member States’ national emissions reduction targets under the “Effort Sharing Regulation”. It would be separate from the existing EU ETS for energy, industry, and intra-EEA aviation sectors.   The new ETS would cover upstream emissions from fuels used in buildings and road transport. It would regulate fuel suppliers rather than end-consumers. The proposed framework includes a cap and a linear reductions factor to control the emissions reduction trajectory, as well as a market stability reserve to adjust the supply of allowances accordingly.  The system is proposed to start operating in 2026. Allowances would be distributed only via auctioning. Auction volumes would be front loaded to ensure a smooth start of the system and sufficient liquidity.   To address social impacts of carbon pricing in the sectors, the European Commission proposed to introduce the Social Climate Fund. A quarter of revenues from the new ETS would be directed to this instrument to support vulnerable groups, and mitigate energy and mobility poverty, with complementary financing from Member States. In addition, the Commission proposed that Member States use the entirety of revenues from emissions trading (both this new and the existing ETS) on climate and energy projects.   The eventual form of these proposals and their details are subject to the negotiations in the Council of the EU and the European Parliament.",https://icapcarbonaction.com/en/ets_system/118,National,,"Transport,Buildings",,,,ICAP
Finland,,Finland,"In March 2021, the Ministry of Transport and Communications in Finland set up a cross-sectoral working group tasked with assessing and preparing for a national ETS to cover the road transport sector. The system’s objective would be to contribute to the government’s goal to halve transport emissions by 2030 compared to 2005 levels.  After the European Commission presented the EU “Fit for 55” package in July 2021, the working group broadened its focus from assessing the option of a national system to considering the proposal for a second EU-level ETS for buildings and road transport. A draft memorandum prepared by the working group contains an overview of the design elements, potential compensatory measures and a roadmap for the implementation of the national system, taking into account the Commission proposal for a second EU-level ETS. The draft was open for public consultation between November and December 2021.  The draft memorandum presents the results of the analysis of the working group, with a final decision by the government on the topic still pending. The draft memorandum observes that both systems are very similar and that a national system could only be introduced in full in 2026, the start year also proposed for the EU system. It concludes that the introduction of a national system would not be required if already-expected national measures (as specified in the “Roadmap to fossil-free transport”) and the EU-level ETS for buildings and road transport are implemented.  However, it presents two transitional options to hedge the risk of delays or lack of agreement on a second ETS at EU-level: a “fixed-price” ETS, similar to that of Germany, or an “emissions trading levy”/ ”fuel tax” that would be implemented as an increase of excise duties. According to the memorandum, these would allow for the introduction of a pricing instrument in Finland before the start of the EU system at relatively low cost. In case an EU system does not materialize, these could then transition into a full auction-based ETS at national level.",https://icapcarbonaction.com/en/ets_system/120,National,,Transport,,,,ICAP
German National Emissions Trading System,2021,Germany,"Germany launched its National Emissions Trading System (in German: Nationales Emissionshandelssystem, or nEHS) for heating and transport fuels in 2021. This measure complements the EU ETS and forms part of the ‘Climate Action Programme 2030,’ a package of measures adopted by the German Federal Cabinet to reach Germany’s 2030 climate targets and aim for climate neutrality by 2050. Because GHG emissions from the country’s energy, industry, and domestic aviation sectors are already covered by the EU ETS, the introduction of the national ETS leads to most major sectors in Germany facing a CO2 price from 2021 onwards. After the release of the ‘Cornerstones for the Design of a National ETS’ in October 2019, the implementing legislation for the nEHS—the ‘Fuel Emissions Trading Act’—was adopted in December 2019 and amended in November 2020. The national ETS will be phased in gradually, with a fixed price per tCO2 from 2021 to 2025. In 2026, auctions with minimum and maximum prices will be introduced. Whether a price corridor will be applied from 2027 onwards has to be decided in 2025. The coverage of fuels will also be gradually expanded.",https://icapcarbonaction.com/en/ets_system/108,National,"Fixed price until 2025, auctioning thereafter; price corridor foreseen for 2026","Transport,Buildings",CO2 only,,301 MtCO2 (2021),ICAP
Indonesia,,Indonesia,"A presidential regulation that provides a national framework for carbon pricing instruments, including an ETS, was signed in October 2021. This regulation extends the “Government Regulation on Environmental Economic Instruments”, which provided a first mandate for an emissions and/or waste permit trading system to be implemented by 2024 (within seven years from its passage). The ETS will eventually work as a hybrid “cap-trade-and-tax” system alongside a carbon tax to be imposed from April 2022, which was regulated in the “Law of the Harmonization of Tax Regulations”. Once the mandatory ETS is in place, facilities that fail to meet their obligations under the system will be subject to the tax, the rate of which will be linked to the price of the domestic carbon market.  These developments follow a period of intense preparation. The MRV guidelines for the power sector were released in mid-2018 based on inputs from a study outlining the emissions profiles and marginal abatement cost curves of the power and industry sectors, in addition to completing the design and governance framework of an MRV system. Following this, an online GHG reporting platform for electricity generators and a pilot MRV program for electricity generators in the Java-Madura-Bali grid (covering ~70% of Indonesia’s electricity demand) were launched in late 2018. The Ministry of Industry has also developed an online GHG emissions reporting system. Pilot MRV programs are being conducted in the cement and fertilizer sectors.  A study completed in late 2018 examined four market-based instrument options: an ETS for the power and industry sectors; energy efficiency certificates for industry; a cap-and-tax system; and a carbon offset mechanism. Based on the study and stakeholder consultations, an ETS scenario was selected for further development, and a voluntary pilot was conducted for the power sector in 2021.",https://icapcarbonaction.com/en/ets_system/104,National,,,,,,ICAP
Japan,,Japan,"The possible expansion of carbon pricing policies beyond the country’s existing carbon tax has been under consideration in Japan for a number of years. Since 2017, several expert committees in Japan have emphasized the key role of a carbon price in decarbonizing the economy.   Following the country’s updated NDC setting a target to reduce GHG emissions in Japan to net zero by 2050, then-Prime Minister Yoshihide Suga instructed the Ministry of the Environment (MoE) and the Ministry of Economy, Trade and Industry (METI) to set up working groups outlining plans for carbon pricing. In August 2021, both ministries issued their interim reports. MoE’s proposes a carbon tax with an eventual rate sufficient to trigger abatement across the economy and raise revenue for supporting technology innovation and diffusion, though it should start low. It also proposes an ETS that scales up auctioning in the early 2030s, with access to voluntary markets. METI’s interim report from the “Study Group on Ideal Economic and Other Approaches for Achieving Worldwide Carbon Neutrality” outlines developing existing domestic credit markets and infrastructure for carbon pricing as part of the future policy response.   In parallel, Japan operates the Advanced Technologies Promotion Subsidy Scheme with Emission Reduction Targets (ASSET) Program, which functions as a voluntary cap-and-trade program. To receive an ASSET subsidy, entities establish a reduction target based on historical emissions and propose new technologies to reach these targets. Entities that implement such technologies and achieve their target are granted the ASSET subsidy. Entities unable to meet their target on their own are permitted to purchase either credits from other participating entities, or so-called “J-Credits”. The government administers the voluntary J-Credit Scheme, where energy saving, renewable energy, and domestic forest management mitigation activities are verified as tradable J-Credits.  Japan is also implementing the Joint Crediting Mechanism (JCM), a bilateral offset crediting mechanism to incentivize low-carbon technologies in 17 partner countries (Mongolia, Bangladesh, Kenya, Ethiopia, Indonesia, Vietnam, Lao PDR, Cambodia, Maldives, Palau, Costa Rica, Mexico, Chile, Saudi Arabia, Myanmar, Thailand, and the Philippines).   From 2022, the government is also working on the detailed design for the implementation of the Green Transformation (GX) League, a baseline-and-credit system for companies setting voluntary targets. This new mechanism will likely build upon existing carbon trading systems such as the JCM or J-Credit scheme.",https://icapcarbonaction.com/en/ets_system/69,National,,,,,,ICAP
Japan - Saitama Target Setting Emissions Trading System,2011,Japan,"Saitama Prefecture’s ETS was established in April 2011 as part of the “Saitama Prefecture Global Warming Strategy Promotion Ordinance”. Large buildings and factories in Saitama Prefecture covered under the program are required to reduce emissions below a facility-specific baseline. They are assigned a higher or lower target, depending on factors such as expected energy efficiency gains and the extent to which they consume energy supplied by other facilities.   Saitama’s ETS is linked to Tokyo’s Cap-and-Trade Program.",https://icapcarbonaction.com/en/ets_system/84,SubNational,Free allocation (Grandparenting),"Buildings,Industry",CO2,Domestic and national,7.3 MtCO2 (2019),ICAP
Japan - Tokyo Cap-and-Trade Program,2010,Japan,"Launched in April 2010, the Cap-and-Trade Program of the Tokyo Metropolitan Government (TMG) is Japan’s first mandatory ETS and is linked to the Saitama ETS. Under the Tokyo ETS, large buildings, factories, heat suppliers, and other facilities that consume large quantities of fossil fuels are required to reduce emissions below a facility-specific baseline.   Facilities covered under the program are assigned a higher or lower target, depending on type of facility and factors such as expected energy efficiency gains and the extent to which they consume energy supplied by other facilities. Facilities that achieve emissions reductions beyond their compliance rate can trade their earned “reduction credits”.",https://icapcarbonaction.com/en/ets_system/51,SubNational,Free Allocation (Grandparenting),"Buildings,Industry",CO2,Domestic and national,12.1 MtCO2 (2019),ICAP
Kazakhstan Emissions Trading System,,Kazakhstan,"Kazakhstan launched its ETS (KAZ ETS) in January 2013. The groundwork for the ETS development was laid out in 2011 through amendments and additions to Kazakhstan’s environmental legislation. The system was temporarily suspended in 2016-2017 to tackle operational issues and reform allocation rules, although MRV obligations still applied. Amendments to the “Environmental Code” were passed in 2016 to improve the MRV system, as well as the overall GHG emissions regulation and operation of the KAZ ETS. Further amendments to the “Environmental Code” in 2017 laid the groundwork for the introduction of benchmarking. The KAZ ETS currently covers 199 installations belonging to 128 operators.",https://icapcarbonaction.com/en/ets_system/46,National,Free Allocation (Benchmarking),"Industry,Power",CO2 only,Domestic,140.3 MtCO2 (2022),ICAP
