Policy,Year,Country,Policy_Content,URL,Scope,Allocation,Sectoral coverage,GHGs covered,Offsets credits,Cap,Source
Korea Emissions Trading Scheme,2015,"Korea, Republic of","The Korea ETS (K-ETS) was launched in 2015, becoming East Asia’s first nationwide mandatory ETS and, at the time, the second-largest carbon market after the EU ETS. The K-ETS covers 684 of the country’s largest emitters, accounting for ~73.5%* of national GHG emissions. It covers direct emissions of six GHGs as well as indirect emissions from electricity consumption. The K-ETS is meant to play an essential role in meeting Korea’s 2030 updated NDC target.  The legal base for green growth and implementation of the K-ETS is the “Framework Act on Low Carbon, Green Growth” (2010). The “Act on Allocation and Trading of Greenhouse Gas Emissions Allowances” (Emissions Trading Act) and its Enforcement Decree, passed in 2012, stipulate government actions, institutions, and timelines for the K-ETS. Further details of the K-ETS have been outlined in three “Master Plans” (January 2014, February 2017 and December 2019). Detailed Allocation Plans have been released for each trading phase (January 2014, July 2018, and September 2020).  The K-ETS was preceded by a mandatory GHG and Energy Target Management System (TMS) launched in 2012 (following a two-year pilot phase that started in 2010). The TMS facilitated the collection of verified emissions data and training in the MRV process and still applies to smaller entities not covered by the K-ETS.      * Phase 3 Allocation Plan factsheet",https://icapcarbonaction.com/en/ets_system/47,National,Free Allocation (Grandparenting; Benchmarking) and auctioning,"Waste,DomesticAviation,Buildings,Industry,Power","CO2, CH4, N2O, PFCs, HFCs, SF6",Domestic and international,589 MtCO2e (2022),ICAP
Malaysia,,Malaysia,"In September 2021, the Malaysian Ministry of Environment and Water (KASA) published the “National Guidance on International Voluntary Market Mechanisms”. The document provides guidance to any entity in Malaysia that intends to participate in international voluntary carbon markets (VCM) and indicates the Ministry’s intent to implement a domestic ETS.  The Cabinet agreed with KASA’s policy document. The KASA Minister said in parliament that a carbon trading platform is planned to be implemented by late 2022, starting first with VCM standards and later a domestic ETS.  In an interview in September 2021, the KASA minister said that the plans are fueled by Malaysia’s ambition to meet its NDC commitment and national net-zero GHG emissions aspiration. Moreover, the plans are to prepare industry players for EU’s proposed carbon border adjustment mechanism and support Malaysia’s low carbon transition in the corporate sector.  In another interview in December 2021, the KASA Minister said that the development of the domestic ETS is in the middle of securing buy-ins from state governments. Furthermore, he explained that the federal government is looking into the ETS market design frameworks, registration, and alignment with international standards. Finally, he mentioned that they are looking into how to make the ETS Shariah compliant.",https://icapcarbonaction.com/en/ets_system/119,National,,,,,,ICAP
Mexico,2023,Mexico,"The Mexican Pilot ETS started operating in January 2020. It was mandated by Transitional Article 94 of the “General Law on Climate Change” (as amended in July 2018) and is regulated by implementing regulation finalized in 2019. The Pilot ETS helps test the system design and ran for two years, plus one year of transition to the full operational ETS. It aims to enhance the quality of emissions data and build capacity in emissions trading for covered entities, ultimately improving the design of the operational phase from 2023 onwards.   The rules for the 2022 transitional phase are yet to be announced. The Ministry of Environment and Natural Resources (SEMARNAT) is expected to publish the regulations of the operational period of the ETS in the first half of 2023. Together, the Pilot phase (2020-2021) and the transition phase (2022) constitute the Pilot Program of the Mexican ETS.    The Pilot covers direct CO2 emissions from entities in the energy and industry sectors generating at least 100,000 tCO2 per year. 282 entities are covered by the Pilot, corresponding to ~40% of national emissions and 90% of emissions reported in the National Emissions Registry (RENE).*  The Mexican Pilot ETS is designed to pose no economic impact on regulated entities; however, in case of noncompliance, entities lose the opportunity to bank unused allowances into the next compliance periods within the Pilot. Moreover, noncompliant entities will receive fewer allowances during the operational period of the national ETS (two fewer allowances for each nondelivered allowance during the Pilot).      * According to SEMARNAT.",https://icapcarbonaction.com/en/ets_system/59,National,Free allocation (Grandparenting),"Industry,Power",Direct emissions of CO2 only,Domestic,273.1 MtCO2 (2021),ICAP
Montenegro ,,Montenegro,"In December 2019, the “Law on Protection from the Negative Impacts of Climate Change” entered into force in Montenegro. The law mandates the development of a comprehensive set of climate policies including a GHG inventory, a low-carbon development strategy, and a national MRV system. It further sets the legal basis for a national ETS for industry and the power sector.  A bylaw specific to the ETS, the “Decree on activities for which a GHG permit is issued”, was adopted in February 2020. The regulation determines sectoral coverage and inclusion thresholds, rules governing trade of permits, allocation rules for auctions, benchmarking and grandparenting, and a market stabilization reserve. It further includes provisions for banking allowances, a minimum reserve price of EUR 24 (USD 28.39), and a linear reduction factor for the emissions cap of 1.5% annually between 2020–2030. Revenue from auction proceeds would go to the Environmental Protection Fund to finance climate innovation, renewable energy, and environmental protection.  Montenegro has been an EU candidate country since 2010 and is required to bring its environmental and climate change policy in line with the EU as part of accession talks (under Chapter 27 of “the acquis”) that began in late 2018. The national ETS would ensure that Montenegro has the climate policy infrastructure in place to take part in the EU ETS should it become a member country of the EU.   Montenegro recommitted to introducing its ETS in November 2020 as a signatory to the Sofia Declaration. In that document, Western Balkan states expressed their intention to align with the “European Green Deal”. In October 2021, they agreed with the EU on a roadmap for implementation reflected in the “Green Agenda Action Plan”. The EU will support such efforts with EUR 9 billion (USD 10.6 billion) in grants and EUR 20 billion (USD 26.3 billion) in investments. Under the agreement, Montenegro will need to fully align its national legislation with the EU’s by 2024.",https://icapcarbonaction.com/en/ets_system/113,National,,,,,,ICAP
New Zealand Emissions Trading Scheme,2008,New Zealand,"The NZ ETS was launched in 2008 and is a central policy for climate change mitigation in New Zealand. It has broad sectoral coverage, including forestry having emissions surrender obligations and the opportunity to earn units for emissions removals. Currently, biological emissions from agriculture have reporting obligations without surrender obligations. The “Climate Change Response Act 2002” sets the legislative framework for the NZ ETS and incorporates all of New Zealand’s key climate legislation under one Act.   After an extensive process of review and public consultation, in 2020 the government enacted sweeping legislative reforms of the NZ ETS to improve its design and operation and enable it to better support New Zealand’s international and domestic emissions reduction obligations.",https://icapcarbonaction.com/en/ets_system/48,National,Free allocation (Benchmarking); Auctioning; Allowances granted for forestry and other removal activities,"Forestry,Waste,DomesticAviation,Transport,Buildings,Industry,Power","CO2, CH4, N2O, SF6, HFCs, and PFCs",None,34.5 MtCO2e (2022),ICAP
Pakistan,,Pakistan,"Pakistan is considering market-based climate policy instruments, including an ETS, to tap into low-cost abatement opportunities and leverage low-carbon investments. The Ministry of Climate Change (MoCC) has received support from the UNFCCC in developing an MRV roadmap, establishing a domestic ETS framework, and in building a communication strategy for carbon pricing. The ongoing work on establishing a MRV system has progressed to the implementation phase while the communication strategy is set to be released in 2022. The MoCC also plans to develop a national carbon registry.   The “Pakistan Climate Change Act, 2017” provides the legal and institutional framework for climate policy in Pakistan. It establishes the cross-ministerial Pakistan Climate Change Council, responsible for the country’s overall climate strategy, as well as the Pakistan Climate Change Authority, which is tasked with coordinating climate policy development and implementation, in addition to designing and establishing a national registry and database on GHG emissions. In 2019, the MoCC, in cooperation with the UNFCCC secretariat and the Institute for Global Environmental Strategies, published a study on carbon pricing which underlined the potential for emissions trading in Pakistan in the power and industrial sectors.   Following the outcomes of the study, Pakistan launched the National Committee on Establishment of Carbon Markets in December 2019 which coordinated ministerial activities on carbon pricing. Among other responsibilities, the one-year committee was tasked with assessing the role and scope of carbon markets in delivering Pakistan’s NDC and identifying opportunities for and challenges to improving emissions data. It reviewed existing carbon market designs, deliberated with national stakeholders, and coordinated information-sharing and capacity-building activities. The MoCC is currently advancing the work in these areas.   Besides a domestic ETS, Pakistan aims to launch credit-based trading mechanisms linked to international carbon markets, which would enable it to supply offsets to partner countries. Provisions are being drafted for domestic instruments under Article 6. Pakistan is also interested in exploring the voluntary carbon market and is in discussion with Verra to build capacity within the private sector.",https://icapcarbonaction.com/en/ets_system/111,National,,,,,,ICAP
Philippines,,Philippines,"In early 2020, the Committee on Climate Change of the Philippine House of Representatives conditionally approved the “Low Carbon Economy Act” House Bill (HB) No. 2184, which includes provisions for a domestic cap-and-trade system. A technical working group has since been established to review the bill and provide recommendations. In its current form, the bill would establish a cap-and-trade system for the industrial and commercial sectors, administered by the Philippine Department of Environment and Natural Resources (DENR) and the Department of Trade and Industry.  However, review of the bill by the technical working group has been delayed by the impacts of Typhoon Rai and the COVID-19 pandemic. An updated version of the bill is expected to be tabled in 2022.  According to the current version of the bill, the cap-and-trade system would cover a variety of GHGs. DENR would be responsible for the design and operation of the system and would determine the key parameters, such as annual targets, cap setting, allocation, monitoring and enforcement. Furthermore, the bill would establish a Climate Reinvestment Fund to be used by DENR to exclusively address global warming. A timeline for implementation has not been specified.",https://icapcarbonaction.com/en/ets_system/114,National,,,,,,ICAP
Russian Federation - Sakhalin,,Russian Federation,"Sakhalin is regarded as a testing ground for identifying GHG regulation measures that can be extended to other Russian regions. In January 2021, the Russian Ministry of Economic Development, in cooperation with the regional government, approved the “Roadmap for the implementation of an experiment to establish special regulation of greenhouse gas emissions in the Sakhalin Region”. The overall aim of the roadmap is to ensure that Sakhalin achieves carbon neutrality by 2025.   Among other measures, the roadmap foresees a pilot carbon trading system, expected to start in 2022. The MRV concept approved by the Russian government in 2015 and the federal law “On limiting greenhouse gas emissions” adopted in 2021 lay the foundation for carrying out MRV procedures at facility level and in Russian regions.",https://icapcarbonaction.com/en/ets_system/115,SubNational,,,,,,ICAP
Swiss ETS,2008,Switzerland,"The Switzerland (Swiss) ETS started in 2008 with a five-year voluntary phase. The system subsequently became mandatory for large, energy-intensive entities, while medium-sized entities may join voluntarily. The Swiss ETS linked with the EU ETS in January 2020. The revised “Ordinance on the Reduction of CO2 Emissions (CO2 Ordinance)”, the implementing legislation of the “CO2 Act”, was adopted in November 2020 to update provisions in line with Phase 4 of the EU ETS. Notable changes to the system included: a revised linear reduction factor from 1.74% to 2.2%; the implementation of updated EU ETS benchmarks; and an indefinite extension of the system.  Alongside linking to the EU ETS, the Swiss ETS was expanded to cover domestic aviation and flights to the European Economic Area and fossil-thermal power plants. The ETS furthermore applies to industrial entities, largely comprising companies from the cement, chemicals, pharmaceuticals, paper, refining, and steel sectors. It covered about 11% of the country’s total GHG emissions in 2019. Participants in the ETS are exempt from the CO2 levy.",https://icapcarbonaction.com/en/ets_system/64,National,Free Allocation (Benchmarking) and Auctioning,"DomesticAviation,Industry,Power","CO2, NO2, CH4, HFCs, NF3, SF6, and theoretically PFCs*",No offsets or international credits can be used for compliance since 2021,"4.9 MtCO2e (2020, industry); 1.1 MtCO2e (2021, aviation)",ICAP
"Taiwan, China",,"Taiwan, Province of China","In July 2015, Taiwan, China enacted the “Greenhouse Gas Reduction and Management Act” (the Act) which legislates a 50% emissions reduction target for 2050 compared to 2005 GHG levels. The Act also mandates the setting of regulatory mitigation goals in stages. In this context, the Act stipulates that the Taiwanese Environmental Protection Administration (TEPA) will implement a domestic cap-and-trade scheme by considering the UNFCCC and its agreements, or relevant decisions by international conventions. This is further referred to in the “Climate Change Action Guideline 2017”.   The Act also mandated TEPA to develop the “GHG Reduction Action Plan”, which outlines details on how to implement the mitigation policies. It includes five-year regulatory goals for both national and sectoral GHG emissions, as well as implementation strategies in the form of eight policy packages. Published in March 2018, the plan proposes to implement a cap-and-trade system, calculate baseline emissions, and set up regulations – albeit without a precise timeline. On this basis, the central industry competent authorities of the six major sectors (energy, manufacturing, transportation, residential and commercial buildings, agriculture, and environment) approved the “GHG Emissions Control Action Programs” in October 2018.   A series of subsidiary regulations have been formulated. Mandatory emissions reporting for entities with annual emissions above 25,000 tCO2e from certain sectors has been ongoing since 2014. Subsidiary regulations also include the “2018 Regulations Governing GHG Offset Program Management”, which provide an opportunity for enterprises to acquire carbon offset credits.    Since the beginning of 2021, TEPA has been revising the Act. In July 2021, TEPA established a new internal climate change office to accelerate relevant legal amendments to keep pace with the EU and international carbon reduction trends. In late October 2021, the draft revision of the Act was published for public consultation and renamed the “Climate Change Response Act”.  It proposed a new carbon fee for domestic emissions, covering potentially both direct and indirect emissions, with revenues to be used to support domestic climate mitigation and the transition to a low carbon economy. The carbon fee would allow the use of domestic offsets. In addition, in response to the international trend of promoting carbon border adjustment mechanisms to avoid carbon leakage, it would also propose a new scheme of levying carbon fees on imported products with high carbon content.   After public consultation, the “Climate Change Response Act” is expected to be submitted to the Legislative Yuan in the first half of 2022 for further review and finalization. Further details of the carbon fee and ETS will be developed via sub-laws. Regulatory discussions are pending on the specific design of the carbon fee and ETS system, timeline of implementation, as well as on how the carbon fee could be transitioned to the ETS in the future and/or co-exist as a complementary mechanism.   Regarding the institutional set up, the carbon fee and the ETS will be managed by TEPA. For the carbon fee, the targets, rate, and percentage of domestic offset allowed will be determined by TEPA. The agency will also design the ETS in consultation with other relevant central competent authorities, and will implement the ETS.",https://icapcarbonaction.com/en/ets_system/86,National,,,,,,ICAP
Thailand,,Thailand,"The “National Reform Plan” (2018) mandated the Thai government to develop an economic instrument to incentivize GHG emissions reductions. This will be considered as part of the policy and legislative process following the formulation of the framework “Climate Change Act”, which is currently under review.   Since 2013, Thailand Greenhouse Gas Management Organization (Public Organization) (TGO) has developed an MRV system and basic trading infrastructures for the Thailand Voluntary Emissions Trading Scheme (Thailand V-ETS). This voluntary pilot program aims to develop and test MRV systems for 12 key GHG-intensive sectors. It also explores target-setting for direct and indirect emissions of individual facilities, practices allocation based on MRV reporting, and simulates allowance trading. TGO also conducts ongoing capacity building activities to engage key stakeholders across Thailand.  Since 2021, TGO has been collaborating with the Eastern Economic Corridor Initiative (Department of Industrial Promotion and Industrial Estate Authority of Thailand) to develop a pilot ETS in Thailand’s EEC region. The emissions trading pilot implementation project will be executed in 2022. It aims to engage 10 pilot organizations to build capabilities in ETS elements, and to provide technical assistance on Thailand Voluntary Emission Reduction (T-VER) project development.    Following COP 26, the government is developing rules and guidelines for carbon credit trading, expected to be released in 2022. As part of this work, TGO is collaborating with the Federation of Thai Industries (FTI) to develop a carbon credit trading platform.",https://icapcarbonaction.com/en/ets_system/81,National,,,,,,ICAP
Turkey,,Turkey,"Turkey has been studying and preparing for the possible use of carbon pricing instruments to help achieve its mitigation targets for a number of years. It ratified the Paris Agreement and submitted its first NDC in October 2021.  A comprehensive mandatory MRV system at installation level has been in place since 2015. Monitoring started in 2015 and reporting (of 2015 emissions) began in 2016. Turkey has worked with the World Bank’s PMR to enhance the MRV regulation through pilot studies in the energy, cement, and refinery sectors.   A synthesis report outlining carbon market policy options for Turkey was submitted to the country’s Climate Change and Adaptation Coordination Board* in November 2018. With additional funding from the PMR, Turkey developed draft legislation as well as improved technical and institutional capacity to prepare the groundwork for piloting a suitable carbon pricing policy. By the end of 2020, the country had held a series of workshops, conducted technical analyses, and organized stakeholder meetings which culminated in:**  a draft legal and institutional framework for a pilot ETS; 	the identification of the emission cap and development of the national allocation plan; 	the development of Turk-SIM, an ETS simulation with gamification features; 	the development of a transaction registry for the pilot ETS; and 	the assessment of Article 6 and options for Turkey. Following the formal end of the PMR in 2020, Turkey has submitted an expression of interest to the Partnership for Market Implementation (PMI), its successor. Turkey is also a candidate for EU accession and thus aims to complete the environmental obligations for membership. The communique from the “Summit on the Fight against Climate Change” in February 2021 refers to Turkey’s intention to introduce an ETS.      * The Board was formerly known as the Climate Change and Air Management Coordination Board and was recently renamed in an institutional reorganization.   ** See https://pmrturkiye.csb.gov.tr/raporlar/ for the associated documents, some of which are only available in Turkish.",https://icapcarbonaction.com/en/ets_system/66,National,,,,,,ICAP
Ukraine,,Ukraine,"Ukraine plans to establish a national ETS in line with its obligations under the “Ukraine-EU Association Agreement”, which entered into force in September 2017. Issues related to climate change are addressed in Article 365 (c) Title V and in Annex XXX to the agreement, which outlines steps for the implementation of a national ETS, including:  adopting national legislation and designating competent authority(ies);  	establishing a system for identifying relevant installations and GHGs; 	developing a national allocation plan to distribute allowances;  	establishing a system to issue allowances to be traded domestically among installations in Ukraine; and 	establishing MRV and enforcement systems, as well as public consultations procedures.  The country established the national MRV system to provide a solid basis for the upcoming ETS. From 2021 onwards, the MRV procedures as adopted in the framework law on MRV have to be applied by regulated installations. By the end of March 2022, covered installations must submit the first monitoring reports for 2021. To establish its ETS, Ukraine plans to develop separate legislation based on at least three years of data from the MRV system. According to a statement made by the Minister of Environmental Protection and Natural Resources in January 2021, the ETS launch could be in 2025.",https://icapcarbonaction.com/en/ets_system/74,National,,,,,,ICAP
United Kingdom,2021,United Kingdom,"The UK Emissions Trading Scheme (UK ETS) started in January 2021. Many design elements of the new system mirror those in phase 4 of the EU ETS, in which the UK had participated since 2005. The UK ETS covers energy-intensive industries, the power sector, and aviation within the UK and European Economic Area (EEA), together making up about one-third of the UK’s GHG emissions.   The scheme’s cap is 5% below the UK’s notional share of the EU ETS cap (i.e., the EUAs that would have been available to the UK government for allocation) and declines by 4.2 Mt per year initially. To ensure market stability, the system has a Cost Containment Mechanism (CCM) and – quite distinct from the EU ETS – a transitional Allowance Reserve Price of GBP 22 (USD 30.26). To safeguard competitiveness and minimize the risk of carbon leakage, a share of allowances will be freely allocated to emissions-intensive trade-exposed (EITE) sectors using an approach similar to phase 4 of the EU ETS.   The UK government remains open to the possibility of linking the UK ETS to other systems, but no decision has been made on the preferred linking partners. Phase 1 of the UK ETS will run until 2030. The entire scheme is due to be reviewed in 2023 and 2028, with ongoing reforms and developments of specific elements in the meantime.",https://icapcarbonaction.com/en/ets_system/99,National,Free allocation (Benchmarking) and Auctioning,"DomesticAviation,Industry,Power","CO2, N2O, PFCs",,151.4 MtCO2e (2022),ICAP
USA - California  Cap-and-Trade Program,2012,USA,"The California Cap-and-Trade Program began operation in 2012, with the opening of its tracking system for allocation, auction distribution, and trading of compliance instruments. Compliance obligations started in January 2013 under the first compliance period, which ended in 2014.  The program is implemented under the authority of the California Air Resources Board (CARB) and covers sources responsible for approximately 74% of the state’s GHG emissions. California has been part of the Western Climate Initiative (WCI) since 2007 and formally linked its cap-and-trade program with Québec’s in January 2014.",https://icapcarbonaction.com/en/ets_system/45,SubNational,"Free allocation: Benchmarking, Free allocation with consignment, Auctioning","Transport,Buildings,Industry,Power","CO2, CH4, N2O, SF6, HFCs, PFCs, NF3, and other fluorinated GHGs.",Domestic,307.5 MtCO2e (2022),ICAP
